{
  "evidence_digest": "sha1:b293eefeaaf6e71c023a999a46e739d095c47ad1",
  "records": [
    {
      "classification": {
        "applicability": [
          "build_input",
          "maintained_source"
        ],
        "category": "build-ci",
        "confidence": "path-derived",
        "provenance": "build-path"
      },
      "hunk_count": 5,
      "hunk_digest": "sha1:70dca10e981a0b94f0750f0974620a1b8ec3f0a3",
      "left": [
        "100644",
        "blob",
        "0892ac19d46748ccd7a226c29da94cd58a1eb496"
      ],
      "path": ".github/actions/configure-docker/action.yml",
      "right": [
        "100644",
        "blob",
        "f0eefba3147a882aef9c17f6d239d90f6f9b5b1f"
      ],
      "status": "modified"
    },
    {
      "classification": {
        "applicability": [
          "build_input",
          "maintained_source"
        ],
        "category": "build-ci",
        "confidence": "path-derived",
        "provenance": "build-path"
      },
      "hunk_count": 12,
      "hunk_digest": "sha1:8d0541534921b246762a74acb61341f7c782cdd6",
      "left": [
        "100644",
        "blob",
        "0f4fc3547da80ace7bdf53872663fca674a3fc53"
      ],
      "path": ".github/actions/restore-caches/action.yml",
      "right": [
        "100644",
        "blob",
        "8dc35d4902edf0161ebb942b7f613915b04c9d91"
      ],
      "status": "modified"
    },
    {
      "classification": {
        "applicability": [
          "build_input",
          "maintained_source"
        ],
        "category": "build-ci",
        "confidence": "path-derived",
        "provenance": "build-path"
      },
      "hunk_count": 8,
      "hunk_digest": "sha1:477f92754624e2c04c8865cfb7637ae09cbc7d6b",
      "left": [
        "100644",
        "blob",
        "ab4ef16521c5d1443fd53b3b47feaf451175920a"
      ],
      "path": ".github/actions/save-caches/action.yml",
      "right": [
        "100644",
        "blob",
        "0e3b31246c617fa94397837a4c9e04329abdaaf2"
      ],
      "status": "modified"
    },
    {
      "classification": {
        "applicability": [
          "build_input",
          "maintained_source"
        ],
        "category": "build-ci",
        "confidence": "path-derived",
        "provenance": "build-path"
      },
      "hunk_count": 1,
      "hunk_digest": "sha1:4dbc167343746e7a0fb3d0bd7ea7cc48ab271abf",
      "left": [
        "100644",
        "blob",
        "0d9da5fe9f6b74f856c6da7afaf638b41c5bbbd2"
      ],
      "path": ".github/actions/setup-windows-gui-tools/action.yml",
      "right": null,
      "status": "added"
    },
    {
      "classification": {
        "applicability": [
          "build_input",
          "maintained_source"
        ],
        "category": "build-ci",
        "confidence": "path-derived",
        "provenance": "build-path"
      },
      "hunk_count": 22,
      "hunk_digest": "sha1:fea654a5d184d7fdcbbfe499f9b619d6e0c7d176",
      "left": [
        "100644",
        "blob",
        "3fa5a1a829ef0d94aba0c1afb7f6e7e9f477c1db"
      ],
      "path": ".github/workflows/ci.yml",
      "right": [
        "100644",
        "blob",
        "6690211292be4487ca035d3d45fe85fdf6501700"
      ],
      "status": "modified"
    },
    {
      "classification": {
        "applicability": [
          "build_input",
          "maintained_source"
        ],
        "category": "build-ci",
        "confidence": "path-derived",
        "provenance": "build-path"
      },
      "hunk_count": 1,
      "hunk_digest": "sha1:e96d668f81d130c98fc178509c3c761024ca4332",
      "left": [
        "100644",
        "blob",
        "454afc6acc32290ecca53662027c432fc6f14817"
      ],
      "path": ".github/workflows/create-release.yml",
      "right": null,
      "status": "added"
    },
    {
      "classification": {
        "applicability": [
          "build_input",
          "maintained_source"
        ],
        "category": "build-ci",
        "confidence": "path-derived",
        "provenance": "build-path"
      },
      "hunk_count": 1,
      "hunk_digest": "sha1:bc4151ea437efeacbebb15c1bd7d1797c0d5cb16",
      "left": [
        "100644",
        "blob",
        "90426c536cccc0372cc0ad9215a85863933aeddd"
      ],
      "path": ".github/workflows/deploy-docs.yml",
      "right": null,
      "status": "added"
    },
    {
      "classification": {
        "applicability": [
          "build_input",
          "maintained_source"
        ],
        "category": "build-ci",
        "confidence": "path-derived",
        "provenance": "build-path"
      },
      "hunk_count": 1,
      "hunk_digest": "sha1:ba045a0f100aebd7f158b4f2831e9ca331a0b363",
      "left": [
        "100644",
        "blob",
        "73c4528405c2c671213608addd9fdb2377eb9ec2"
      ],
      "path": ".github/workflows/nightly.yml",
      "right": null,
      "status": "added"
    },
    {
      "classification": {
        "applicability": [
          "build_input",
          "maintained_source"
        ],
        "category": "build-ci",
        "confidence": "path-derived",
        "provenance": "build-path"
      },
      "hunk_count": 1,
      "hunk_digest": "sha1:dbdd26f54079fd8b40845870b6101fb4cab8a863",
      "left": [
        "100644",
        "blob",
        "54ae48f6d14feb474d460495a7b357a33b3342c8"
      ],
      "path": ".github/workflows/release.yml",
      "right": null,
      "status": "added"
    },
    {
      "classification": {
        "applicability": [
          "build_input",
          "maintained_source"
        ],
        "category": "build-ci",
        "confidence": "path-derived",
        "provenance": "build-path"
      },
      "hunk_count": 6,
      "hunk_digest": "sha1:84cd9b71e2cf270dfaa7a7d07259ad785f31b4fe",
      "left": [
        "100644",
        "blob",
        "cf55456c6644b12d7c49792bf8d4fae66822e717"
      ],
      "path": "CMakeLists.txt",
      "right": [
        "100644",
        "blob",
        "d0e798aee6218b312bf9dc554c11f9c339aa869c"
      ],
      "status": "modified"
    },
    {
      "classification": {
        "applicability": [
          "maintained_source"
        ],
        "category": "release-metadata",
        "confidence": "path-derived",
        "provenance": "root-path"
      },
      "hunk_count": 4,
      "hunk_digest": "sha1:e82d9ffff5cf2896adfb49f00122964183deba2f",
      "left": [
        "100644",
        "blob",
        "8b73eecbfd105cd209eb77ddf3381fcb61b00d6f"
      ],
      "path": "CONTRIBUTING.md",
      "right": [
        "100644",
        "blob",
        "8d19ed9ee495d15643eb130faa920c1adeb55692"
      ],
      "status": "modified"
    },
    {
      "classification": {
        "applicability": [
          "maintained_source"
        ],
        "category": "release-metadata",
        "confidence": "path-derived",
        "provenance": "root-path"
      },
      "hunk_count": 20,
      "hunk_digest": "sha1:e819a46a15b85d7b1641e341fd05e24ed45d92ed",
      "left": [
        "100644",
        "blob",
        "120baa378fc64fd84a013f587fa90b89d005e4d5"
      ],
      "path": "README.md",
      "right": [
        "100644",
        "blob",
        "fe5e3d98ba593e0c78a789d31f10d041aaeb042a"
      ],
      "status": "modified"
    },
    {
      "classification": {
        "applicability": [
          "maintained_source"
        ],
        "category": "release-metadata",
        "confidence": "path-derived",
        "provenance": "root-path"
      },
      "hunk_count": 1,
      "hunk_digest": "sha1:1f0a96a7952e705dca4e953bd4f1094a6d95c4ca",
      "left": [
        "100644",
        "blob",
        "817fc2e2d375e3817a178a728ccb298dd6fea9ee"
      ],
      "path": "SECURITY.md",
      "right": [
        "100644",
        "blob",
        "769168593bc087a5f9bbd0cb42462cfd20ef7674"
      ],
      "status": "modified"
    },
    {
      "classification": {
        "applicability": [
          "build_input",
          "maintained_source"
        ],
        "category": "build-ci",
        "confidence": "path-derived",
        "provenance": "build-path"
      },
      "hunk_count": 1,
      "hunk_digest": "sha1:4d4d3a66e891726a25a5e018a8f6964f0ed3ee45",
      "left": [
        "100644",
        "blob",
        "c54720773ecc71b29a3f13ad32dbdf0cab37cba9"
      ],
      "path": "ci/README.md",
      "right": [
        "100644",
        "blob",
        "81e048ce687cac81c4bec316fe27917de5c3a501"
      ],
      "status": "modified"
    },
    {
      "classification": {
        "applicability": [
          "build_input",
          "maintained_source"
        ],
        "category": "build-ci",
        "confidence": "path-derived",
        "provenance": "build-path"
      },
      "hunk_count": 1,
      "hunk_digest": "sha1:59d36d161ff7d2d804034a2bf24701707b28daf5",
      "left": [
        "100644",
        "blob",
        "ebe3df3252f1fee385f0ae00b3f8bac74ffe0dad"
      ],
      "path": "ci/change-classifier-policy.json",
      "right": null,
      "status": "added"
    },
    {
      "classification": {
        "applicability": [
          "build_input",
          "maintained_source"
        ],
        "category": "build-ci",
        "confidence": "path-derived",
        "provenance": "build-path"
      },
      "hunk_count": 1,
      "hunk_digest": "sha1:f88d57cce9401e5aab8792ddabd315ce25d52381",
      "left": [
        "100755",
        "blob",
        "c4276f8b170a7c317535be5400fb4c5dc33d1320"
      ],
      "path": "ci/change-classifier.py",
      "right": null,
      "status": "added"
    },
    {
      "classification": {
        "applicability": [
          "build_input",
          "maintained_source"
        ],
        "category": "build-ci",
        "confidence": "path-derived",
        "provenance": "build-path"
      },
      "hunk_count": 3,
      "hunk_digest": "sha1:b6a8038a45790d7cd961cc65c42c03efff26d022",
      "left": [
        "100755",
        "blob",
        "c99ade6e8bc69615c640b524aaf942c0ceba9bb0"
      ],
      "path": "ci/lint/06_script.sh",